{
  "schema_version": "1.0",
  "revision": 1,
  "environment": "staging",
  "generated_at": "2026-08-20T14:50:00Z",
  "keys": [
    {
      "key_id": "pilot-local-staging-schedule-2026-01",
      "algorithm": "ed25519",
      "public_key_ed25519_base64": "TVWgnZIgOIKIdjZJbE1NOw6uHJfkors4910KvF54kOo=",
      "status": "active",
      "not_before": "2026-08-20T14:50:00Z"
    }
  ]
}
